{
  "type": "node",
  "totalHits": 2,
  "moreResults": false,
  "results": [
    {
      "id": "123",
      "labels": ["Person"],
      "properties": {
        "name": "Alice Smith",
        "age": 30,
        "email": "alice@example.com",
        "city": "New York",
        "occupation": "Software Engineer"
      }
    },
    {
      "id": "456",
      "labels": ["Person", "Employee"],
      "properties": {
        "name": "Alice Johnson",
        "age": 28,
        "email": "alice.johnson@company.com",
        "department": "Engineering",
        "hire_date": "2020-01-15"
      }
    }
  ]
}
